{
  "schemaVersion": "0.1.0",
  "hostId": "host_debian_12_review_packet_1776805736172_558",
  "ruleId": "rule_steady_state_review_rule_1776805736384_967",
  "port": 40753,
  "tcpReachable": true,
  "httpStatus": 200,
  "pageTitle": "Debian 12 Review Relay Healthy",
  "finalUrl": "http://127.0.0.1:40753/status",
  "tls": {
    "enabled": false
  },
  "capturedAt": "2026-04-21T22:12:48.441Z"
}